,id,text,created_at,as dusk falls,retweet_count,reply_count,like_count,quote_count,polarity
924,1601435286701064194,As Dusk Falls Wins Games for Impact,2022-12-10T04:35:00.000Z,1.0,0,0,0,0,0.3
5230,1601255611215515648,Big congratulations to our friends at on their win at last night It s been an absolute pleasure working with the team  amp  we are thrilled to bits to see As Dusk Falls receive this well deserved recognition,2022-12-09T16:41:02.000Z,1.0,0,0,3,0,0.32
8032,1601197600719351809,Here s a round up for those who missed night  Among Us  Hide n Seek mode out today New look at Atomic Heart Party Animals now launching early  Replaced got a new trailer  coming  As Dusk Falls won Games for Impact award,2022-12-09T12:50:31.000Z,1.0,12,3,103,1,0.043181818181818175
9844,1601158000026484737,As Dusk Fallsfor ImpactMoss  Book IIVR ARThe Legend of Zelda  Tears of the KingdomAnticipatedMultiversusFightingKirby and the Forgotten Land FamilyArcane League of LegendsAdaptationGenshin ImpactPlayer Voice2 ,2022-12-09T10:13:09.000Z,1.0,0,1,3,0,0.0
25705,1601063942859952128,As quedaron los ganadores en  GoW  Ragnarok  6 Elden Ring  4 Stray  2 FF XIV  2 Kirby and the Forgotten Land  1  Multiversus  1 Moss  Book II  1 Mario Rabbids Sparks of Hope  1 As Dusk Falls  1 GT  1 Splatoon  1 Bayonetta  1 Genshin Impact  1 ,2022-12-09T03:59:24.000Z,1.0,0,0,4,0,0.0
